{
  "title": "视频剪辑工作流",
  "generation_mode": "faithful",
  "source_scope": "complete",
  "communication_goal": {
    "central_idea": "",
    "audience_takeaway": "",
    "desired_action": ""
  },
  "diagram_type": "hybrid",
  "reading_direction": "left-to-right",
  "source_images": ["source-sketch.png"],
  "nodes": [
    {"id":"shooting-material","text":"拍摄素材","confidence":1.0,"observed":true,"source":"image"},
    {"id":"main-footage","text":"主镜头｜采访、人物","confidence":1.0,"observed":true,"source":"image"},
    {"id":"b-roll","text":"补充镜头｜空镜、细节","confidence":1.0,"observed":true,"source":"image"},
    {"id":"audio","text":"音频｜旁白、音乐","confidence":1.0,"observed":true,"source":"image"},
    {"id":"media-bin-a","text":"素材箱 A","confidence":1.0,"observed":true,"source":"image"},
    {"id":"media-bin-b","text":"素材箱 B","confidence":1.0,"observed":true,"source":"image"},
    {"id":"media-bin-c","text":"素材箱 C","confidence":1.0,"observed":true,"source":"image"},
    {"id":"editor-a","text":"剪辑师 A","confidence":1.0,"observed":true,"source":"image"},
    {"id":"rough-cut","text":"粗剪｜结构、节奏","confidence":1.0,"observed":true,"source":"image"},
    {"id":"fine-cut","text":"精剪｜镜头、转场","confidence":1.0,"observed":true,"source":"image"},
    {"id":"editor-b","text":"剪辑师 B","confidence":1.0,"observed":true,"source":"image"},
    {"id":"color-grade","text":"调色｜曝光、色彩","confidence":1.0,"observed":true,"source":"image"},
    {"id":"horizontal-output","text":"横版成片｜长视频","confidence":1.0,"observed":true,"source":"image"},
    {"id":"vertical-output","text":"竖版成片｜短视频","confidence":1.0,"observed":true,"source":"image"}
  ],
  "groups": [
    {"id":"media-organization","label":"素材整理","kind":"container","parent_id":null,"member_ids":["shooting-material","main-footage","b-roll","audio","media-bin-a","media-bin-b","media-bin-c"]},
    {"id":"editing-production","label":"剪辑制作","kind":"container","parent_id":null,"member_ids":["editor-a","rough-cut","fine-cut","editor-b","color-grade","horizontal-output","vertical-output"]}
  ],
  "edges": [
    {"id":"e1","source":"shooting-material","target":"main-footage","direction":"forward","kind":"hierarchy","confidence":1.0},
    {"id":"e2","source":"shooting-material","target":"b-roll","direction":"forward","kind":"hierarchy","confidence":1.0},
    {"id":"e3","source":"shooting-material","target":"audio","direction":"forward","kind":"hierarchy","confidence":1.0},
    {"id":"e4","source":"main-footage","target":"media-bin-a","direction":"forward","kind":"sequence","confidence":1.0},
    {"id":"e5","source":"b-roll","target":"media-bin-b","direction":"forward","kind":"sequence","confidence":1.0},
    {"id":"e6","source":"audio","target":"media-bin-c","direction":"forward","kind":"sequence","confidence":1.0},
    {"id":"e7","source":"editor-a","target":"rough-cut","direction":"forward","kind":"hierarchy","confidence":1.0},
    {"id":"e8","source":"editor-a","target":"fine-cut","direction":"forward","kind":"hierarchy","confidence":1.0},
    {"id":"e9","source":"editor-b","target":"color-grade","direction":"forward","kind":"hierarchy","confidence":1.0},
    {"id":"e10","source":"rough-cut","target":"horizontal-output","direction":"forward","kind":"sequence","confidence":1.0},
    {"id":"e11","source":"rough-cut","target":"vertical-output","direction":"forward","kind":"sequence","confidence":1.0},
    {"id":"e12","source":"fine-cut","target":"horizontal-output","direction":"forward","kind":"sequence","confidence":1.0},
    {"id":"e13","source":"fine-cut","target":"vertical-output","direction":"forward","kind":"sequence","confidence":1.0},
    {"id":"e14","source":"color-grade","target":"horizontal-output","direction":"forward","kind":"sequence","confidence":1.0},
    {"id":"e15","source":"color-grade","target":"vertical-output","direction":"forward","kind":"sequence","confidence":1.0}
  ],
  "annotations": [],
  "semantic_additions": [],
  "uncertainties": [],
  "layout_hints": {
    "rank_groups": [["shooting-material"],["main-footage","b-roll","audio"],["media-bin-a","media-bin-b","media-bin-c"]],
    "keep_together": [["editor-a","rough-cut","fine-cut"],["editor-b","color-grade"]],
    "visual_order": ["media-organization","editing-production"]
  }
}
